<?xml version="1.0" encoding="UTF-8"?>
<!--?xml-stylesheet type="text/xsl" href="catalogo.xsl"?-->
<data xmlns="http://www.monti.it" xmlns:xsd="http://www.w3.org/2001/XMLSchema-instance" xsd:schemaLocation="http://www.monti.it schema.xsd">
	<iscritti>
		<utente>
			<username>Riki</username>
			<password>password</password>
			<nome>Riccardo</nome>
			<cognome>De Stefani</cognome>
			<email>riccardo.destefani@gmail.com</email>
			<telefono>3485281914</telefono>
		</utente>
		<utente>
			<username>Ale</username>
			<password>password</password>
			<nome>Alessandro</nome>
			<cognome>Cornaglia</cognome>
			<email>ale.corny@gmail.com</email>
			<telefono>3485281915</telefono>
		</utente>
		<utente>
			<username>Catte</username>
			<password>password</password>
			<nome>Giacomo</nome>
			<cognome>Cattelan</cognome>
			<email>giacomo.cattelan@gmail.com</email>
			<telefono>3485281916</telefono>
		</utente>
	</iscritti>
	<prodotti>
		<vino>
			<etichetta>Fior d'arancio</etichetta>
         <immagine>images/prodotti/fiordarancio.png</immagine>
			<categoria>Bianco</categoria>
			<stato>Frizzante</stato>
			<colore>Colore giallo paglierino.....</colore>
         <prezzo valuta="euro">20.36</prezzo>
		</vino>
		<vino>
			<etichetta>Barbera</etichetta>
         <immagine>images/prodotti/fiordarancio.png</immagine>
			<categoria>Rosso</categoria>
			<stato>Fermo</stato>
			<colore>Colore rosso intenso.....</colore>
         <prezzo valuta="euro">20.25</prezzo>
		</vino>
	</prodotti>
</data>
